{
  "schemaVersion": 1,
  "status": "PROPOSED",
  "captureAuthorized": false,
  "orderReady": false,
  "claimBoundary": {"isSchematic":false,"isNetlist":false,"isBom":false,"isFootprint":false,"schematicEntryAcceptance":null},
  "sourceContracts": ["docs/DESIGN-READINESS-CHECKLIST.md","docs/SIGNAL-POWER-OWNERSHIP.md","docs/research/issue-19-controller-route/README.md","evidence/ledger.json"],
  "portDomains": [
    {"id":"UPSTREAM_A","role":"HOST","ownedSignals":["CC","PD","VBUS","VCONN"],"sharesCcOrVbusWith":[]},
    {"id":"UPSTREAM_B","role":"HOST","ownedSignals":["CC","PD","VBUS","VCONN"],"sharesCcOrVbusWith":[]},
    {"id":"DOWNSTREAM_DOCK","role":"DOCK","ownedSignals":["CC","PD","VBUS","VCONN"],"sharesCcOrVbusWith":[]}
  ],
  "futureSheets": ["UPSTREAM_A_PD_POWER","UPSTREAM_B_PD_POWER","HS_USB2_SBU_SELECT","TB4_ROUTER","DOWNSTREAM_PD_POWER","SYSTEM_POWER","MCU_UI"],
  "safetyInvariants": ["HOST_A_VBUS_NEVER_JOINS_HOST_B_VBUS","HOST_A_CC_NEVER_JOINS_HOST_B_CC","THREE_TYPE_C_DOMAINS_REMAIN_INDEPENDENT","BREAK_BEFORE_MAKE_FOR_SIGNAL_AND_HOST_POWER","PD_AND_POWER_PROTECTION_OUTRANK_MCU","MCU_NEVER_INTERCEPTS_20GBPS_LANES","ALL_CONNECTOR_ORIENTATIONS_REQUIRE_TEST","SHELL_AND_SIGNAL_GROUND_REVIEWED_SEPARATELY"],
  "safeDefaults": {"onPowerOn":"ALL_PATHS_DISABLED","onMcuReset":"ALL_PATHS_DISABLED","onBrownout":"ALL_PATHS_DISABLED","hostAVbusSource":"DISABLED","hostBVbusSource":"DISABLED","highSpeedSelect":"DISABLED","usb2Select":"DISABLED","sbuSelect":"DISABLED","newHostPdAdvertise":"DISABLED_UNTIL_OLD_HOST_ISOLATION_VERIFIED"},
  "integratedGates": [
    {"id":"GATE-INT-001","status":"BLOCKED"},{"id":"GATE-DS-001","status":"BLOCKED"},{"id":"GATE-PD-001","status":"BLOCKED"},{"id":"GATE-SI-001","status":"BLOCKED"},{"id":"GATE-FAB-001","status":"BLOCKED"},{"id":"GATE-PCB1-PARTS-001","status":"BLOCKED"},{"id":"GATE-PCB1-BUDGET-001","status":"BLOCKED"},{"id":"GATE-COLLATERAL-ADOPTION-001","status":"BLOCKED"}
  ],
  "controlledFacts": [
    {"id":"ROUTER_IDENTITY","issueIds":[19],"gateIds":["GATE-INT-001"],"candidateIdentities":["Intel JHL8440","Intel JHL9440"],"selectedCandidate":null,"collateralClass":"REGISTRATION_GATED_OR_NDA_CONFIDENTIAL","permittedPublicMetadata":["public product identity","public lifecycle and ordering metadata","public source links"],"requiredSourceRevision":"CURRENT_INTEL_REFERENCE_DESIGN_REVISION","requiredReviewTestModel":["independent electrical review","reference topology review","authorized bring-up/recovery review"],"blockedAcceptance":{"sourceRevision":null,"review":null,"test":null,"model":null}},
    {"id":"PD_DOMAIN_IMPLEMENTATION","issueIds":[19,20,21],"gateIds":["GATE-INT-001","GATE-DS-001","GATE-PD-001"],"candidateIdentities":["Infineon CYPD5235","Infineon CYPD5236"],"selectedCandidate":null,"collateralClass":"PUBLIC_LINK_ONLY_PLUS_GATED_REFERENCE","permittedPublicMetadata":["public part identity","public datasheet revision","public product and tool links"],"requiredSourceRevision":"CURRENT_CONTROLLER_MATCHED_PD_REFERENCE_REVISION","requiredReviewTestModel":["independent PD/power review","all-role fault test plan","orientation model"],"blockedAcceptance":{"sourceRevision":null,"review":null,"test":null,"model":null}},
    {"id":"POWER_PROTECTION_TOPOLOGY","issueIds":[20,21],"gateIds":["GATE-DS-001","GATE-PD-001"],"candidateIdentities":[],"selectedCandidate":null,"collateralClass":"GATED_REFERENCE_AND_PROJECT_DERIVED_REVIEW","permittedPublicMetadata":["gate identity","safe-state requirements","public source links"],"requiredSourceRevision":"ACCEPTED_REFERENCE_POWER_AND_FAULT_ANALYSIS_REVISION","requiredReviewTestModel":["independent power safety review","injected fault test","transition state model"],"blockedAcceptance":{"sourceRevision":null,"review":null,"test":null,"model":null}},
    {"id":"HIGH_SPEED_CHANNEL","issueIds":[5,6,7,8,34],"gateIds":["GATE-SI-001","GATE-FAB-001","GATE-PCB1-PARTS-001","GATE-PCB1-BUDGET-001"],"candidateIdentities":["router-reference-approved high-speed mux"],"selectedCandidate":null,"collateralClass":"PUBLIC_LINK_ONLY_PLUS_GATED_MODELS","permittedPublicMetadata":["candidate function","public product links","measurement contract links"],"requiredSourceRevision":"FROZEN_STACKUP_AND_REFERENCE_APPROVED_CHANNEL_MODEL_REVISION","requiredReviewTestModel":["independent SI review","end-to-end channel simulation","reference-plane-specific measurement model"],"blockedAcceptance":{"sourceRevision":null,"review":null,"test":null,"model":null}},
    {"id":"FIRMWARE_NVM_RECOVERY","issueIds":[19],"gateIds":["GATE-INT-001"],"candidateIdentities":[],"selectedCandidate":null,"collateralClass":"NDA_CONFIDENTIAL_OR_RELEASE_PARTY_CONTROLLED","permittedPublicMetadata":["document title","revision/date","access restriction","redistribution classification"],"requiredSourceRevision":"AUTHORIZED_FIRMWARE_NVM_AND_RECOVERY_PACKAGE_REVISION","requiredReviewTestModel":["independent recovery review","program-readback-rollback test","supported toolchain verification"],"blockedAcceptance":{"sourceRevision":null,"review":null,"test":null,"model":null}},
    {"id":"COLLATERAL_REDISTRIBUTION","issueIds":[19,22],"gateIds":["GATE-COLLATERAL-ADOPTION-001","GATE-INT-001"],"candidateIdentities":[],"selectedCandidate":null,"collateralClass":"CLASSIFICATION_PENDING_OWNER_ADOPTION","permittedPublicMetadata":["title","revision/date","access restriction","entitlement owner","permitted hash metadata"],"requiredSourceRevision":"WRITTEN_REDISTRIBUTION_TERMS_REVISION","requiredReviewTestModel":["independent collateral review","redistribution policy validation","release-boundary review"],"blockedAcceptance":{"sourceRevision":null,"review":null,"test":null,"model":null}}
  ]
}
